id	source	language	query	source_id	url	keywords
2106	leetcode	java	There is an m x n grid, where (0, 0) is the top-left cell and (m - 1, n - 1) is the bottom-right cell.	2087	https://leetcode.com/problems/minimum-cost-homecoming-of-a-robot-in-a-grid/	is m x n grid is top-left cell is bottom-right cell
2107	leetcode	java	You are given a 0-indexed integer array nums of length n.	2270	https://leetcode.com/problems/number-of-ways-to-split-array/	are given 0-indexed integer array nums length n
2108	leetcode	java	You are given an array of integers nums. You are also given an integer original which is the first number that needs to be searched for in nums.	2154	https://leetcode.com/problems/keep-multiplying-found-values-by-two/	are given array integers nums are given integer original is first number needs be searched nums
2109	leetcode	java	Your country has an infinite number of lakes. Initially, all the lakes are empty, but when it rains over the nth lake, the nth lake becomes full of water.	1488	https://leetcode.com/problems/avoid-flood-in-the-city/	country has infinite number lakes lakes are empty rains nth lake nth lake becomes full water
2110	leetcode	java	Solve a given equation and return the value of 'x' in the form of a string "x=#value". The equation contains only '+', '-' operation, the variable 'x' and its coefficient.	640	https://leetcode.com/problems/solve-the-equation/	Solve given equation return value x form string x= value equation contains '+ '- operation variable x coefficient
2111	leetcode	java	You are given an integer array nums and two integers limit and goal. The array nums has an interesting property that abs(nums[i]) <= limit.	1785	https://leetcode.com/problems/minimum-elements-to-add-to-form-a-given-sum/	are given integer array nums integers limit goal array nums has interesting property abs nums [ i ] < = limit
2112	leetcode	java	You are given a 0-indexed array of n integers differences, which describes the differences between each pair of consecutive integers of a hidden sequence of length (n + 1).	2145	https://leetcode.com/problems/count-the-hidden-sequences/	are given 0-indexed array n integers differences describes differences pair consecutive integers hidden sequence length n +
2113	leetcode	java	Given a palindromic string of lowercase English letters palindrome, replace exactly one character with any lowercase English letter so that the resulting string is not a palindrome and that it is the	1328	https://leetcode.com/problems/break-a-palindrome/	Given palindromic string lowercase English letters palindrome replace character lowercase English letter resulting string is palindrome is
2114	leetcode	java	Given an integer array nums, return all the different possible increasing subsequences of the given array with at least two elements. You may return the answer in any order.	491	https://leetcode.com/problems/increasing-subsequences/	Given integer array nums return different possible increasing subsequences given array least elements return answer order
2115	leetcode	java	Design a data structure that follows the constraints of a Least Recently Used (LRU) cache. Implement the LRUCache class: - LRUCache(int capacity) Initialize the LRU cache with positive size capacity.	146	https://leetcode.com/problems/lru-cache/	Design data structure follows constraints Least Recently Used LRU cache Implement LRUCache class LRUCache int capacity Initialize LRU cache positive size capacity
2116	leetcode	java	Given an n x n matrix where each of the rows and columns is sorted in ascending order, return the kth smallest element in the matrix.	378	https://leetcode.com/problems/kth-smallest-element-in-a-sorted-matrix/	Given n x n matrix rows columns is sorted ascending order return kth smallest element matrix
2117	leetcode	java	Given a string date representing a Gregorian calendar date formatted as YYYY-MM-DD, return the day number of the year.	1154	https://leetcode.com/problems/day-of-the-year/	Given string date representing Gregorian calendar date formatted YYYY-MM-DD return day number year
2118	leetcode	java	Given a triangle array, return the minimum path sum from top to bottom. For each step, you may move to an adjacent number of the row below.	120	https://leetcode.com/problems/triangle/	Given triangle array return minimum path sum top bottom step move adjacent number row
2119	leetcode	java	You are given a 0-indexed 2D array grid of size 2 x n, where grid[r][c] represents the number of points at position (r, c) on the matrix.	2017	https://leetcode.com/problems/grid-game/	are given 0-indexed array grid size x n grid [ r ] [ c ] represents number points position r c matrix
2120	leetcode	java	Given an unsorted array of integers nums, return the length of the longest consecutive elements sequence. You must write an algorithm that runs in O(n) time.	128	https://leetcode.com/problems/longest-consecutive-sequence/	Given unsorted array integers nums return length longest consecutive elements sequence write algorithm runs O time
2121	leetcode	java	Given an integer columnNumber, return its corresponding column title as it appears in an Excel sheet.	168	https://leetcode.com/problems/excel-sheet-column-title/	Given integer columnNumber return corresponding column title appears Excel sheet
2122	leetcode	java	Given a binary array nums, return the maximum length of a contiguous subarray with an equal number of 0 and 1.	525	https://leetcode.com/problems/contiguous-array/	Given binary array nums return maximum length contiguous subarray equal number
2123	leetcode	java	There are 3n piles of coins of varying size, you and your friends will take piles of coins as follows: - In each step, you will choose any 3 piles of coins	1561	https://leetcode.com/problems/maximum-number-of-coins-you-can-get/	are piles coins varying size friends take piles coins follows step choose piles coins
2124	leetcode	java	Given a binary search tree (BST), find the lowest common ancestor (LCA) of two given nodes in the BST.	235	https://leetcode.com/problems/lowest-common-ancestor-of-a-binary-search-tree/	Given binary search tree BST find lowest common ancestor LCA given nodes BST
2125	leetcode	java	You are given a string array words and a string s, where words[i] and s comprise only of lowercase English letters.	2255	https://leetcode.com/problems/count-prefixes-of-a-given-string/	are given string array words string s words [ i ] s comprise lowercase English letters
2126	leetcode	java	Design an algorithm that collects daily price quotes for some stock and returns the span of that stock's price for the current day.	901	https://leetcode.com/problems/online-stock-span/	Design algorithm collects daily price quotes stock returns span stock price current day
2127	leetcode	java	You are given an integer array arr. You can choose a set of integers and remove all the occurrences of these integers in the array.	1338	https://leetcode.com/problems/reduce-array-size-to-the-half/	are given integer array arr choose set integers remove occurrences integers array
2128	leetcode	java	You have an initial power of power, an initial score of 0, and a bag of tokens where tokens[i] is the value of the ith token (0-indexed).	948	https://leetcode.com/problems/bag-of-tokens/	have initial power power initial score bag tokens tokens [ i ] is value ith token 0-indexed
2129	leetcode	java	Given a sentence that consists of some words separated by a single space, and a searchWord, check if searchWord is a prefix of any word in sentence.	1455	https://leetcode.com/problems/check-if-a-word-occurs-as-a-prefix-of-any-word-in-a-sentence/	Given sentence consists words separated single space searchWord check searchWord is prefix word sentence
2130	leetcode	java	Given a 2D integer array circles where circles[i] = [xi, yi, ri] represents the center (xi, yi) and radius ri of the ith circle drawn on a grid, return the number of	2249	https://leetcode.com/problems/count-lattice-points-inside-a-circle/	Given integer array circles circles [ i ] = [ xi yi ri ] represents center yi radius ri ith circle drawn grid return number
2131	leetcode	java	The power of an integer x is defined as the number of steps needed to transform x into 1 using the following steps: - if x is even then x = x	1387	https://leetcode.com/problems/sort-integers-by-the-power-value/	power integer x is defined number steps needed transform x using following steps x is x = x
2132	leetcode	java	Given an integer array nums, move all 0's to the end of it while maintaining the relative order of the non-zero elements.	283	https://leetcode.com/problems/move-zeroes/	Given integer array nums move end maintaining relative order non-zero elements
2133	leetcode	java	Given a date, return the corresponding day of the week for that date. The input is given as three integers representing the day, month and year respectively.	1185	https://leetcode.com/problems/day-of-the-week/	Given date return corresponding day week date input is given integers representing day month year
2134	leetcode	java	Given an integer array nums, handle multiple queries of the following type: 1. Calculate the sum of the elements of nums between indices left and right inclusive where left <= right.	303	https://leetcode.com/problems/range-sum-query-immutable/	Given integer array nums handle multiple queries following type Calculate sum elements nums indices left right inclusive left < = right
2135	leetcode	java	Given a binary array nums and an integer k, return the maximum number of consecutive 1's in the array if you can flip at most k 0's.	1004	https://leetcode.com/problems/max-consecutive-ones-iii/	Given binary array nums integer k return maximum number consecutive array flip most k
2136	leetcode	java	Given two 0-indexed integer arrays nums1 and nums2, return a list answer of size 2 where: - answer[0] is a list of all distinct integers in nums1 which are not present in	2215	https://leetcode.com/problems/find-the-difference-of-two-arrays/	Given 0-indexed integer arrays return list answer size answer [ ] is list distinct integers nums1 are present
2137	leetcode	java	You are given the string croakOfFrogs, which represents a combination of the string "croak" from different frogs, that is, multiple frogs can croak at the same time, so multiple "croak" are mixed.	1419	https://leetcode.com/problems/minimum-number-of-frogs-croaking/	are given string croakOfFrogs represents combination string croak different frogs is multiple frogs croak same time multiple croak are mixed
2138	leetcode	java	Given an integer array nums and an integer k, return true if nums has a continuous subarray of size at least two whose elements sum up to a multiple of k, or	523	https://leetcode.com/problems/continuous-subarray-sum/	Given integer array nums integer k return true nums has continuous subarray size least elements sum multiple k
2139	leetcode	java	Given a string licensePlate and an array of strings words, find the shortest completing word in words. A completing word is a word that contains all the letters in licensePlate.	748	https://leetcode.com/problems/shortest-completing-word/	Given string licensePlate array strings words find shortest completing word words completing word is word contains letters licensePlate
2140	leetcode	java	You are given the root of a binary tree that consists of exactly 3 nodes: the root, its left child, and its right child.	2236	https://leetcode.com/problems/root-equals-sum-of-children/	are given root binary tree consists nodes root left child right child
2141	leetcode	java	Given a string s and a dictionary of strings wordDict, return true if s can be segmented into a space-separated sequence of one or more dictionary words.	139	https://leetcode.com/problems/word-break/	Given string s dictionary strings wordDict return true s be segmented space-separated sequence more dictionary words
2142	leetcode	java	Design the CombinationIterator class: - CombinationIterator(string characters, int combinationLength) Initializes the object with a string characters of sorted distinct lowercase English letters and a number combinationLength as arguments.	1286	https://leetcode.com/problems/iterator-for-combination/	Design CombinationIterator class CombinationIterator string characters int combinationLength Initializes object string characters sorted distinct lowercase English letters number combinationLength arguments
2143	leetcode	java	You are given an m x n matrix M initialized with all 0's and an array of operations ops, where ops[i] = [ai, bi] means M[x][y] should be incremented by one for	598	https://leetcode.com/problems/range-addition-ii/	are given m x n matrix M initialized array operations ops ops [ i ] = [ ai bi ] means M [ x ] [ y ] be incremented
2144	leetcode	java	You are given an array of integers nums and an integer target.	1498	https://leetcode.com/problems/number-of-subsequences-that-satisfy-the-given-sum-condition/	are given array integers nums integer target
2145	leetcode	java	Given an integer n, return true if it is a power of four. Otherwise, return false.	342	https://leetcode.com/problems/power-of-four/	Given integer n return true is power return false
2146	leetcode	java	You are given an array of positive integers beans, where each integer represents the number of magic beans found in a particular magic bag.	2172	https://leetcode.com/problems/removing-minimum-number-of-magic-beans/	are given array positive integers beans integer represents number magic beans found particular magic bag
2147	leetcode	java	You are given the root of a binary tree with n nodes where each node in the tree has node.val coins. There are n coins in total throughout the whole tree.	979	https://leetcode.com/problems/distribute-coins-in-binary-tree/	are given root binary tree n nodes node tree has node.val coins are n coins total whole tree
2148	leetcode	java	Given an integer numRows, return the first numRows of Pascal's triangle. In Pascal's triangle, each number is the sum of the two numbers directly above it as shown:	118	https://leetcode.com/problems/pascals-triangle/	Given integer numRows return first numRows Pascal triangle Pascal triangle number is sum numbers above shown
2149	leetcode	java	Given a binary tree with the following rules: 1. root.val == 0 2. If treeNode.val == x and treeNode.left != null, then treeNode.left.val == 2 * x + 1 3. If treeNode.	1261	https://leetcode.com/problems/find-elements-in-a-contaminated-binary-tree/	Given binary tree following rules root.val == treeNode.val == x treeNode.left = null treeNode.left.val == * x + treeNode
2150	leetcode	java	Given an integer n, return the count of all numbers with unique digits, x, where 0 <= x < 10n.	357	https://leetcode.com/problems/count-numbers-with-unique-digits/	Given integer n return count numbers unique digits x < = x <
2151	leetcode	java	You are playing a game involving a circular array of non-zero integers nums.	457	https://leetcode.com/problems/circular-array-loop/	are playing game involving circular array non-zero integers nums
2152	leetcode	java	You are given a string text of words that are placed among some number of spaces.	1592	https://leetcode.com/problems/rearrange-spaces-between-words/	are given string text words are placed number spaces
2153	leetcode	java	Given a m * n matrix of ones and zeros, return how many square submatrices have all ones.	1277	https://leetcode.com/problems/count-square-submatrices-with-all-ones/	Given m * matrix ones zeros return many square submatrices have ones
2154	leetcode	java	You are given a string allowed consisting of distinct characters and an array of strings words. A string is consistent if all characters in the string appear in the string allowed.	1684	https://leetcode.com/problems/count-the-number-of-consistent-strings/	are given string allowed consisting distinct characters array strings words string is consistent characters string appear string allowed
2155	leetcode	java	Given an array of integers arr. We want to select three indices i, j and k where (0 <= i < j <= k < arr.length).	1442	https://leetcode.com/problems/count-triplets-that-can-form-two-arrays-of-equal-xor/	Given array integers arr want select indices j k < = i < j < = k < arr.length
2156	leetcode	java	Given an array of integers arr, and three integers a, b and c. You need to find the number of good triplets.	1534	https://leetcode.com/problems/count-good-triplets/	Given array integers arr integers b c. need find number good triplets
2157	leetcode	java	You are given an integer n. Each number from 1 to n is grouped according to the sum of its digits. Return the number of groups that have the largest size.	1399	https://leetcode.com/problems/count-largest-group/	are given integer n. number n is grouped according sum digits Return number groups have largest size
2158	leetcode	java	There is a special square room with mirrors on each of the four walls.	858	https://leetcode.com/problems/mirror-reflection/	is special square room mirrors walls
2159	leetcode	java	In English, we have a concept called root, which can be followed by some other word to form another longer word - let's call this word successor.	648	https://leetcode.com/problems/replace-words/	English have concept called root be followed other word form longer word let call word successor
2160	leetcode	java	Given an array, rotate the array to the right by k steps, where k is non-negative.	189	https://leetcode.com/problems/rotate-array/	Given array rotate array right k steps k is non-negative
2161	leetcode	java	You are given a phone number as a string number. number consists of digits, spaces ' ', and/or dashes '-'. You would like to reformat the phone number in a certain manner.	1694	https://leetcode.com/problems/reformat-phone-number/	are given phone number string number number consists digits spaces and/or dashes like reformat phone number certain manner
2162	leetcode	java	Given the head of a sorted linked list, delete all duplicates such that each element appears only once. Return the linked list sorted as well.	83	https://leetcode.com/problems/remove-duplicates-from-sorted-list/	Given head sorted linked list delete duplicates such element appears Return linked list sorted
2163	leetcode	java	You are given an integer array coins representing coins of different denominations and an integer amount representing a total amount of money.	322	https://leetcode.com/problems/coin-change/	are given integer array coins representing coins different denominations integer amount representing total amount money
2164	leetcode	java	Consider all the leaves of a binary tree, from left to right order, the values of those leaves form a leaf value sequence.	872	https://leetcode.com/problems/leaf-similar-trees/	Consider leaves binary tree left right order values leaves form leaf value sequence
2165	leetcode	java	A sentence is a list of words that are separated by a single space with no leading or trailing spaces.	2114	https://leetcode.com/problems/maximum-number-of-words-found-in-sentences/	sentence is list words are separated single space leading trailing spaces
2166	leetcode	java	Given a string s and a string array dictionary, return the longest string in the dictionary that can be formed by deleting some of the given string characters.	524	https://leetcode.com/problems/longest-word-in-dictionary-through-deleting/	Given string s string array dictionary return longest string dictionary be formed deleting given string characters
2167	leetcode	java	You are given two integer arrays of equal length target and arr. In one step, you can select any non-empty sub-array of arr and reverse it.	1460	https://leetcode.com/problems/make-two-arrays-equal-by-reversing-sub-arrays/	are given integer arrays equal length target arr step select non-empty sub-array arr reverse
2168	leetcode	java	There is a directed graph of n nodes with each node labeled from 0 to n - 1.	802	https://leetcode.com/problems/find-eventual-safe-states/	is directed graph n nodes node labeled n
2169	leetcode	java	You are given an integer array score of size n, where score[i] is the score of the ith athlete in a competition. All the scores are guaranteed to be unique.	506	https://leetcode.com/problems/relative-ranks/	are given integer array score size n score [ i ] is score ith athlete competition scores are guaranteed be unique
2170	leetcode	java	ou have n dice and each die has k faces numbered from 1 to k.	1157	https://leetcode.com/problems/number-of-dice-rolls-with-target-sum/	ou have n dice die has k faces numbered k
2171	leetcode	java	Given an array arr of 4 digits, find the latest 24-hour time that can be made using each digit exactly once.	949	https://leetcode.com/problems/largest-time-for-given-digits/	Given array arr digits find latest 24-hour time be made using digit
2172	leetcode	java	An image is represented by an m x n integer grid image where image[i][j] represents the pixel value of the image. You are also given three integers sr, sc, and color.	733	https://leetcode.com/problems/flood-fill/	image is represented m x integer grid image image [ i ] [ j ] represents pixel value image are given integers sr sc color
2173	leetcode	java	A binary string is monotone increasing if it consists of some number of 0's (possibly none), followed by some number of 1's (also possibly none). You are given a binary string s.	926	https://leetcode.com/problems/flip-string-to-monotone-increasing/	binary string is increasing consists number none followed number none are given binary string s
2174	leetcode	java	Given an m x n matrix, return all elements of the matrix in spiral order.	54	https://leetcode.com/problems/spiral-matrix/	Given m x n matrix return elements matrix spiral order
2175	leetcode	java	You are given a string of digits num, such as "123456579". We can split it into a Fibonacci-like sequence [123, 456, 579].	842	https://leetcode.com/problems/split-array-into-fibonacci-sequence/	are given string digits such split Fibonacci-like sequence [ ]
2176	leetcode	java	Given a 1-indexed array of integers numbers that is already sorted in non-decreasing order, find two numbers such that they add up to a specific target number.	167	https://leetcode.com/problems/two-sum-ii-input-array-is-sorted/	Given 1-indexed array integers numbers is sorted non-decreasing order find numbers such add specific target number
2177	leetcode	java	There are numBottles water bottles that are initially full of water. You can exchange numExchange empty water bottles from the market with one full water bottle.	1518	https://leetcode.com/problems/water-bottles/	are numBottles water bottles are full water exchange numExchange empty water bottles market full water bottle
2178	leetcode	java	Given a string s consisting of only the characters 'a' and 'b', return true if every 'a' appears before every 'b' in the string. Otherwise, return false.	2124	https://leetcode.com/problems/check-if-all-as-appears-before-all-bs/	Given string s consisting characters b return true appears b string Otherwise return false
2179	leetcode	java	At a lemonade stand, each lemonade costs $5. Customers are standing in a queue to buy from you and order one at a time (in the order specified by bills).	860	https://leetcode.com/problems/lemonade-change/	lemonade stand lemonade costs Customers are standing queue buy order time order specified bills
2180	leetcode	java	Given an integer array nums sorted in non-decreasing order, return an array of the squares of each number sorted in non-decreasing order.	977	https://leetcode.com/problems/squares-of-a-sorted-array/	Given integer array nums sorted non-decreasing order return array squares number sorted non-decreasing order
2181	leetcode	java	You are given an integer array nums and an integer k. In one operation, you can choose any index i where 0 <= i < nums.	908	https://leetcode.com/problems/smallest-range-i/	are given integer array nums integer k. operation choose index i < = i < nums
2182	leetcode	java	The Tribonacci sequence Tn is defined as follows: T0 = 0, T1 = 1, T2 = 1, and Tn+3 = Tn + Tn+1 + Tn+2 for n >= 0.	1137	https://leetcode.com/problems/n-th-tribonacci-number/	Tribonacci sequence Tn is defined follows T0 = T1 = T2 = Tn+3 = Tn + Tn+1 + Tn+2 n > =
2183	leetcode	java	Given a string s and an array of strings words, return the number of words[i] that is a subsequence of s.	792	https://leetcode.com/problems/number-of-matching-subsequences/	Given string s array strings words return number words [ i ] is subsequence s
2184	leetcode	java	Given a string s and a character letter, return the percentage of characters in s that equal letter rounded down to the nearest whole percent.	2278	https://leetcode.com/problems/percentage-of-letter-in-string/	Given string s character letter return percentage characters s equal letter rounded nearest whole percent
2185	leetcode	java	You are given a string s that consists of only digits.	1849	https://leetcode.com/problems/splitting-a-string-into-descending-consecutive-values/	are given string s consists only digits
2186	leetcode	java	You are given the heads of two sorted linked lists list1 and list2. Merge the two lists in a one sorted list.	21	https://leetcode.com/problems/merge-two-sorted-lists/	are given heads sorted linked lists list1 list2 Merge lists sorted list
2187	leetcode	java	Given a string s consisting of words and spaces, return the length of the last word in the string. A word is a maximal substring consisting of non-space characters only.	58	https://leetcode.com/problems/length-of-last-word/	Given string s consisting words spaces return length last word string word is maximal substring consisting non-space characters
2188	leetcode	java	Implement pow(x, n), which calculates x raised to the power n (i.e., xn).	50	https://leetcode.com/problems/powx-n/	Implement pow n calculates x raised power n xn
