id	source	language	query	source_id	url	keywords
1771	leetcode	python	Given an array of integers arr. We want to select three indices i, j and k where (0 <= i < j <= k < arr.length).	1442	https://leetcode.com/problems/count-triplets-that-can-form-two-arrays-of-equal-xor/	Given array integers arr want select indices j k < = i < j < = k < arr.length
1772	leetcode	python	Given an array of integers arr, and three integers a, b and c. You need to find the number of good triplets.	1534	https://leetcode.com/problems/count-good-triplets/	Given array integers arr integers b c. need find number good triplets
1773	leetcode	python	You are given an integer n. Each number from 1 to n is grouped according to the sum of its digits. Return the number of groups that have the largest size.	1399	https://leetcode.com/problems/count-largest-group/	are given integer n. number n is grouped according sum digits Return number groups have largest size
1774	leetcode	python	There is a special square room with mirrors on each of the four walls.	858	https://leetcode.com/problems/mirror-reflection/	is special square room mirrors walls
1775	leetcode	python	In English, we have a concept called root, which can be followed by some other word to form another longer word - let's call this word successor.	648	https://leetcode.com/problems/replace-words/	English have concept called root be followed other word form longer word let call word successor
1776	leetcode	python	Given an array, rotate the array to the right by k steps, where k is non-negative.	189	https://leetcode.com/problems/rotate-array/	Given array rotate array right k steps k is non-negative
1777	leetcode	python	You are given a phone number as a string number. number consists of digits, spaces ' ', and/or dashes '-'. You would like to reformat the phone number in a certain manner.	1694	https://leetcode.com/problems/reformat-phone-number/	are given phone number string number number consists digits spaces and/or dashes like reformat phone number certain manner
1778	leetcode	python	Given the head of a sorted linked list, delete all duplicates such that each element appears only once. Return the linked list sorted as well.	83	https://leetcode.com/problems/remove-duplicates-from-sorted-list/	Given head sorted linked list delete duplicates such element appears Return linked list sorted
1779	leetcode	python	You are given an integer array coins representing coins of different denominations and an integer amount representing a total amount of money.	322	https://leetcode.com/problems/coin-change/	are given integer array coins representing coins different denominations integer amount representing total amount money
1780	leetcode	python	Consider all the leaves of a binary tree, from left to right order, the values of those leaves form a leaf value sequence.	872	https://leetcode.com/problems/leaf-similar-trees/	Consider leaves binary tree left right order values leaves form leaf value sequence
1781	leetcode	python	A sentence is a list of words that are separated by a single space with no leading or trailing spaces.	2114	https://leetcode.com/problems/maximum-number-of-words-found-in-sentences/	sentence is list words are separated single space leading trailing spaces
1782	leetcode	python	Given a string s and a string array dictionary, return the longest string in the dictionary that can be formed by deleting some of the given string characters.	524	https://leetcode.com/problems/longest-word-in-dictionary-through-deleting/	Given string s string array dictionary return longest string dictionary be formed deleting given string characters
1783	leetcode	python	You are given two integer arrays of equal length target and arr. In one step, you can select any non-empty sub-array of arr and reverse it.	1460	https://leetcode.com/problems/make-two-arrays-equal-by-reversing-sub-arrays/	are given integer arrays equal length target arr step select non-empty sub-array arr reverse
1784	leetcode	python	There is a directed graph of n nodes with each node labeled from 0 to n - 1.	802	https://leetcode.com/problems/find-eventual-safe-states/	is directed graph n nodes node labeled n
1785	leetcode	python	You are given an integer array score of size n, where score[i] is the score of the ith athlete in a competition. All the scores are guaranteed to be unique.	506	https://leetcode.com/problems/relative-ranks/	are given integer array score size n score [ i ] is score ith athlete competition scores are guaranteed be unique
1786	leetcode	python	ou have n dice and each die has k faces numbered from 1 to k.	1157	https://leetcode.com/problems/number-of-dice-rolls-with-target-sum/	ou have n dice die has k faces numbered k
1787	leetcode	python	Given an array arr of 4 digits, find the latest 24-hour time that can be made using each digit exactly once.	949	https://leetcode.com/problems/largest-time-for-given-digits/	Given array arr digits find latest 24-hour time be made using digit
1788	leetcode	python	An image is represented by an m x n integer grid image where image[i][j] represents the pixel value of the image. You are also given three integers sr, sc, and color.	733	https://leetcode.com/problems/flood-fill/	image is represented m x integer grid image image [ i ] [ j ] represents pixel value image are given integers sr sc color
1789	leetcode	python	A binary string is monotone increasing if it consists of some number of 0's (possibly none), followed by some number of 1's (also possibly none). You are given a binary string s.	926	https://leetcode.com/problems/flip-string-to-monotone-increasing/	binary string is increasing consists number none followed number none are given binary string s
1790	leetcode	python	Given an m x n matrix, return all elements of the matrix in spiral order.	54	https://leetcode.com/problems/spiral-matrix/	Given m x n matrix return elements matrix spiral order
1791	leetcode	python	You are given a string of digits num, such as "123456579". We can split it into a Fibonacci-like sequence [123, 456, 579].	842	https://leetcode.com/problems/split-array-into-fibonacci-sequence/	are given string digits such split Fibonacci-like sequence [ ]
1792	leetcode	python	Given a 1-indexed array of integers numbers that is already sorted in non-decreasing order, find two numbers such that they add up to a specific target number.	167	https://leetcode.com/problems/two-sum-ii-input-array-is-sorted/	Given 1-indexed array integers numbers is sorted non-decreasing order find numbers such add specific target number
1793	leetcode	python	There are numBottles water bottles that are initially full of water. You can exchange numExchange empty water bottles from the market with one full water bottle.	1518	https://leetcode.com/problems/water-bottles/	are numBottles water bottles are full water exchange numExchange empty water bottles market full water bottle
1794	leetcode	python	Given a string s consisting of only the characters 'a' and 'b', return true if every 'a' appears before every 'b' in the string. Otherwise, return false.	2124	https://leetcode.com/problems/check-if-all-as-appears-before-all-bs/	Given string s consisting characters b return true appears b string Otherwise return false
1795	leetcode	python	At a lemonade stand, each lemonade costs $5. Customers are standing in a queue to buy from you and order one at a time (in the order specified by bills).	860	https://leetcode.com/problems/lemonade-change/	lemonade stand lemonade costs Customers are standing queue buy order time order specified bills
1796	leetcode	python	Given an integer array nums sorted in non-decreasing order, return an array of the squares of each number sorted in non-decreasing order.	977	https://leetcode.com/problems/squares-of-a-sorted-array/	Given integer array nums sorted non-decreasing order return array squares number sorted non-decreasing order
1797	leetcode	python	You are given an integer array nums and an integer k. In one operation, you can choose any index i where 0 <= i < nums.	908	https://leetcode.com/problems/smallest-range-i/	are given integer array nums integer k. operation choose index i < = i < nums
1798	leetcode	python	The Tribonacci sequence Tn is defined as follows: T0 = 0, T1 = 1, T2 = 1, and Tn+3 = Tn + Tn+1 + Tn+2 for n >= 0.	1137	https://leetcode.com/problems/n-th-tribonacci-number/	Tribonacci sequence Tn is defined follows T0 = T1 = T2 = Tn+3 = Tn + Tn+1 + Tn+2 n > =
1799	leetcode	python	Given a string s and an array of strings words, return the number of words[i] that is a subsequence of s.	792	https://leetcode.com/problems/number-of-matching-subsequences/	Given string s array strings words return number words [ i ] is subsequence s
1800	leetcode	python	Given a string s and a character letter, return the percentage of characters in s that equal letter rounded down to the nearest whole percent.	2278	https://leetcode.com/problems/percentage-of-letter-in-string/	Given string s character letter return percentage characters s equal letter rounded nearest whole percent
1801	leetcode	python	You are given a string s that consists of only digits.	1849	https://leetcode.com/problems/splitting-a-string-into-descending-consecutive-values/	are given string s consists only digits
1802	leetcode	python	You are given the heads of two sorted linked lists list1 and list2. Merge the two lists in a one sorted list.	21	https://leetcode.com/problems/merge-two-sorted-lists/	are given heads sorted linked lists list1 list2 Merge lists sorted list
1803	leetcode	python	Given a string s consisting of words and spaces, return the length of the last word in the string. A word is a maximal substring consisting of non-space characters only.	58	https://leetcode.com/problems/length-of-last-word/	Given string s consisting words spaces return length last word string word is maximal substring consisting non-space characters
1804	leetcode	python	Implement pow(x, n), which calculates x raised to the power n (i.e., xn).	50	https://leetcode.com/problems/powx-n/	Implement pow n calculates x raised power n xn
1805	leetcode	python	Given a string s containing an out-of-order English representation of digits 0-9, return the digits in ascending order.	423	https://leetcode.com/problems/reconstruct-original-digits-from-english/	Given string s containing out-of-order English representation digits 0-9 return digits ascending order
1806	leetcode	python	Given an array of integers nums, find the maximum length of a subarray where the product of all its elements is positive.	1567	https://leetcode.com/problems/maximum-length-of-subarray-with-positive-product/	Given array integers nums find maximum length subarray product elements is positive
1807	leetcode	python	Given the root of an n-ary tree, return the postorder traversal of its nodes' values. Nary-Tree input serialization is represented in their level order traversal.	590	https://leetcode.com/problems/n-ary-tree-postorder-traversal/	Given root n-ary tree return postorder traversal nodes values Nary-Tree input serialization is represented level order traversal
1808	leetcode	python	You are given an array of positive integers beans, where each integer represents the number of magic beans found in a particular magic bag.	2171	https://leetcode.com/problems/removing-minimum-number-of-magic-beans/	are given array positive integers beans integer represents number magic beans found particular magic bag
1809	leetcode	python	ou are given an integer array nums where the ith bag contains nums[i] balls. You are also given an integer maxOperations.	1760	https://leetcode.com/problems/minimum-limit-of-balls-in-a-bag/	ou are given integer array nums ith bag contains nums [ i ] balls are given integer maxOperations
1810	leetcode	python	Given an array nums of n integers, return an array of all the unique quadruplets [nums[a], nums[b], nums[c], nums[d]] such that: 0 <= a, b, c, d < n a, b, c,	18	https://leetcode.com/problems/4sum/	Given array nums n integers return array unique quadruplets [ nums [ ] nums [ b ] nums [ c ] [ d ] ] such < = b c d < b c
1811	leetcode	python	You are given an integer finalSum. Split it into a sum of a maximum number of unique positive even integers.	2178	https://leetcode.com/problems/maximum-split-of-positive-even-integers/	are given integer finalSum Split sum maximum number unique positive integers
1812	leetcode	python	Given the head of a singly linked list, group all the nodes with odd indices together followed by the nodes with even indices, and return the reordered list.	328	https://leetcode.com/problems/odd-even-linked-list/	Given head linked list group nodes odd indices followed nodes indices return reordered list
1813	leetcode	python	Given a reference of a node in a connected undirected graph. Return a deep copy (clone) of the graph.	133	https://leetcode.com/problems/clone-graph/	Given reference node connected undirected graph Return deep copy clone graph
1814	leetcode	python	Given the root of a binary tree, return the bottom-up level order traversal of its nodes' values. (i.e., from left to right, level by level from leaf to root).	107	https://leetcode.com/problems/binary-tree-level-order-traversal-ii/	Given root binary tree return bottom-up level order traversal nodes values i.e. left right level level leaf root
1815	leetcode	python	Given a zero-based permutation nums (0-indexed), build an array ans of the same length where ans[i] = nums[nums[i]] for each 0 <= i < nums.length and return it.	1920	https://leetcode.com/problems/build-array-from-permutation/	Given zero-based permutation nums 0-indexed build array ans same length ans [ i ] = nums [ nums [ i ] ] < = i < nums.length return
1816	leetcode	python	You are given a string s representing an attendance record for a student where each character signifies whether the student was absent, late, or present on that day.	551	https://leetcode.com/problems/student-attendance-record-i/	are given string s representing attendance record student character signifies student was absent late present day
1817	leetcode	python	TinyURL is a URL shortening service where you enter a URL such as https://leetcode.com/problems/design-tinyurl and it returns a short URL such as http://tinyurl.com/4e9iAk.	535	https://leetcode.com/problems/encode-and-decode-tinyurl/	TinyURL is URL shortening service enter URL such https //leetcode.com/problems/design-tinyurl returns short URL such http //tinyurl.com/4e9iAk
1818	leetcode	python	There are n people, each person has a unique id between 0 and n-1.	1311	https://leetcode.com/problems/get-watched-videos-by-your-friends/	are n people person has unique id n-1
1819	leetcode	python	Return the number of permutations of 1 to n so that prime numbers are at prime indices (1-indexed.	1175	https://leetcode.com/problems/prime-arrangements/	Return number permutations n prime numbers are prime indices 1-indexed
1820	leetcode	python	Given the head of a singly linked list, return the middle node of the linked list. If there are two middle nodes, return the second middle node.	876	https://leetcode.com/problems/middle-of-the-linked-list/	Given head linked list return middle node linked list are middle nodes return second middle node
1821	leetcode	python	Given an integer array nums, find the maximum possible bitwise OR of a subset of nums and return the number of different non-empty subsets with the maximum bitwise OR.	2044	https://leetcode.com/problems/count-number-of-maximum-bitwise-or-subsets/	Given integer array nums find maximum possible bitwise OR subset nums return number different non-empty subsets maximum bitwise OR
1822	leetcode	python	Given an integer array arr, return the mean of the remaining integers after removing the smallest 5% and the largest 5% of the elements.	1619	https://leetcode.com/problems/mean-of-array-after-removing-some-elements/	Given integer array arr return mean remaining integers removing smallest % largest % elements
1823	leetcode	python	A kingdom consists of a king, his children, his grandchildren, and so on. Every once in a while, someone in the family dies or a child is born.	1600	https://leetcode.com/problems/throne-inheritance/	kingdom consists king children grandchildren while someone family dies child is born
1824	leetcode	python	Given an integer n, break it into the sum of k positive integers, where k >= 2, and maximize the product of those integers. Return the maximum product you can get.	343	https://leetcode.com/problems/integer-break/	Given integer n break sum k positive integers k > = maximize product integers Return maximum product get
1825	leetcode	python	Given an array of integers temperatures represents the daily temperatures, return an array answer such that answer[i] is the number of days you have to wait after the ith day to get	739	https://leetcode.com/problems/daily-temperatures/	Given array integers temperatures represents daily temperatures return array answer such answer [ i ] is number days have wait ith day get
1826	leetcode	python	Given an array nums of integers, a move consists of choosing any element and decreasing it by 1.	1144	https://leetcode.com/problems/decrease-elements-to-make-array-zigzag/	Given array nums integers move consists choosing element decreasing
1827	leetcode	python	ou are given a list of preferences for n friends, where n is always even. For each person i, preferences[i] contains a list of friends sorted in the order of preference.	1583	https://leetcode.com/problems/count-unhappy-friends/	ou are given list preferences n friends n is person i preferences [ i ] contains list friends sorted order preference
1828	leetcode	python	Given an integer n, return any array containing n unique integers such that they add up to 0.	1304	https://leetcode.com/problems/find-n-unique-integers-sum-up-to-zero/	Given integer n return array containing n unique integers such add
1829	leetcode	python	Given a root node reference of a BST and a key, delete the node with the given key in the BST. Return the root node reference (possibly updated) of the BST.	450	https://leetcode.com/problems/delete-node-in-a-bst/	Given root node reference BST key delete node given key BST Return root node reference updated BST
1830	leetcode	python	Given a string s, return the number of segments in the string. A segment is defined to be a contiguous sequence of non-space characters.	434	https://leetcode.com/problems/number-of-segments-in-a-string/	Given string s return number segments string segment is defined be contiguous sequence non-space characters
1831	leetcode	python	Given a 0-indexed integer array nums, return the number of distinct quadruplets (a, b, c, d) such that: - nums[a] + nums[b] + nums[c] == nums[d], and - a < b <	1995	https://leetcode.com/problems/count-special-quadruplets/	Given 0-indexed integer array nums return number distinct quadruplets b c d such nums [ ] + nums [ b ] + nums [ c ] == nums [ d ] < b <
1832	leetcode	python	A phrase is a palindrome if, after converting all uppercase letters into lowercase letters and removing all non-alphanumeric characters, it reads the same forward and backward. Alphanumeric characters include letters and numbers.	125	https://leetcode.com/problems/valid-palindrome/	phrase is palindrome converting uppercase letters lowercase letters removing non-alphanumeric characters reads same forward backward Alphanumeric characters include letters numbers
1833	leetcode	python	A valid parentheses string is either empty "", "(" + A + ")", or A + B, where A and B are valid parentheses strings, and + represents string concatenation.	1021	https://leetcode.com/problems/remove-outermost-parentheses/	valid parentheses string is empty + A + A + B B are valid parentheses strings + represents string concatenation
1834	leetcode	python	There is a special typewriter with lowercase English letters 'a' to 'z' arranged in a circle with a pointer.	1974	https://leetcode.com/problems/minimum-time-to-type-word-using-special-typewriter/	is special typewriter lowercase English letters z arranged circle pointer
1835	leetcode	python	You are given an integer array nums and an integer k. Append k unique positive integers that do not appear in nums to nums such that the resulting total sum is minimum.	2195	https://leetcode.com/problems/append-k-integers-with-minimal-sum/	are given integer array nums integer k. Append k unique positive integers do appear nums nums such resulting total sum is minimum
1836	leetcode	python	Given the root of a binary tree, return its maximum depth.	1993	https://leetcode.com/problems/operations-on-tree/	Given root binary tree return maximum depth
1837	leetcode	python	There are n points on a road you are driving your taxi on.	2008	https://leetcode.com/problems/maximum-earnings-from-taxi/	are n points road are driving taxi
1838	leetcode	python	Given two integers left and right that represent the range [left, right], return the bitwise AND of all numbers in this range, inclusive.	201	https://leetcode.com/problems/bitwise-and-of-numbers-range/	Given integers left right represent range [ left right ] return bitwise AND numbers range inclusive
1839	leetcode	python	An integer x is numerically balanced if for every digit d in the number x, there are exactly d occurrences of that digit in x.	2048	https://leetcode.com/problems/next-greater-numerically-balanced-number/	integer x is balanced digit d number x are d occurrences digit x
1840	leetcode	python	You are given an integer total indicating the amount of money you have. You are also given two integers cost1 and cost2 indicating the price of a pen and pencil respectively.	2240	https://leetcode.com/problems/number-of-ways-to-buy-pens-and-pencils/	are given integer total indicating amount money have are given integers cost1 cost2 indicating price pen pencil
1841	leetcode	python	You are given an integer array coins of length n which represents the n coins that you own. The value of the ith coin is coins[i].	1798	https://leetcode.com/problems/maximum-number-of-consecutive-values-you-can-make/	are given integer array coins length n represents n coins own value ith coin is coins [ i ]
1842	leetcode	python	Given the head of a linked list, rotate the list to the right by k places.	61	https://leetcode.com/problems/rotate-list/	Given head linked list rotate list right k places
1843	leetcode	python	Given an integer num, return three consecutive integers (as a sorted array) that sum to num. If num cannot be expressed as the sum of three consecutive integers, return an empty array.	2177	https://leetcode.com/problems/find-three-consecutive-integers-that-sum-to-a-given-number/	Given integer num return consecutive integers sorted array sum num num be expressed sum consecutive integers return empty array
1844	leetcode	python	You are given a 0-indexed integer array nums and an integer k. You are initially standing at index 0.	1696	https://leetcode.com/problems/jump-game-vi/	are given 0-indexed integer array nums integer k. are standing index
1845	leetcode	python	You are given two strings word1 and word2. Merge the strings by adding letters in alternating order, starting with word1.	1768	https://leetcode.com/problems/merge-strings-alternately/	are given strings word1 word2 Merge strings adding letters alternating order starting word1
1846	leetcode	python	Given an array of integers nums, you start with an initial positive value startValue.	1413	https://leetcode.com/problems/minimum-value-to-get-positive-step-by-step-sum/	Given array integers nums start initial positive value startValue
1847	leetcode	python	Given a 0-indexed integer array nums of length n and an integer k, return the number of pairs (i, j) where 0 <= i < j < n, such that nums[i] ==	2176	https://leetcode.com/problems/count-equal-and-divisible-pairs-in-an-array/	Given 0-indexed integer array nums length n integer k return number pairs i j < = i < j < such nums [ i ] ==
1848	leetcode	python	Given an integer array nums of size n, return the minimum number of moves required to make all array elements equal.	462	https://leetcode.com/problems/minimum-moves-to-equal-array-elements-ii/	Given integer array nums size n return minimum number moves required make array elements equal
1849	leetcode	python	Given a string of English letters s, return the greatest English letter which occurs as both a lowercase and uppercase letter in s. The returned letter should be in uppercase.	2309	https://leetcode.com/problems/greatest-english-letter-in-upper-and-lower-case/	Given string English letters s return greatest English letter occurs lowercase uppercase letter s. returned letter be uppercase
1850	leetcode	python	Given a circular integer array nums (i.e., the next element of nums[nums.length - 1] is nums[0]), return the next greater number for every element in nums.	503	https://leetcode.com/problems/next-greater-element-ii/	Given circular integer array nums i.e. next element nums [ ] is nums ] return next greater number element nums
1851	leetcode	python	Given an integer array of size n, find all elements that appear more than ⌊ n/3 ⌋ times.	229	https://leetcode.com/problems/majority-element-ii/	Given integer array size n find elements appear more ⌊ n/3 ⌋ times
1852	leetcode	python	Given two string arrays words1 and words2, return the number of strings that appear exactly once in each of the two arrays.	2085	https://leetcode.com/problems/count-common-words-with-one-occurrence/	Given string arrays words1 words2 return number strings appear arrays
1853	leetcode	python	Given two strings first and second, consider occurrences in some text of the form "first second third", where second comes immediately after first, and third comes immediately after second.	1078	https://leetcode.com/problems/occurrences-after-bigram/	Given strings second consider occurrences text form first second third second comes first third comes second
