id	source	language	query	source_id	url	keywords
1153	leetcodeTitles	java	Keys and Rooms	841	https://leetcode.com/problems/keys-and-rooms/	Keys Rooms
1154	leetcodeTitles	java	Complement of Base 10 Integer	1009	https://leetcode.com/problems/complement-of-base-10-integer/	Complement Base Integer
1155	leetcodeTitles	java	Remove Duplicates from Sorted List II	82	https://leetcode.com/problems/remove-duplicates-from-sorted-list-ii/	Remove Duplicates Sorted List II
1156	leetcodeTitles	java	Pascal's Triangle II	119	https://leetcode.com/problems/pascals-triangle-ii/	Pascal Triangle II
1157	leetcodeTitles	java	Stock Price Fluctuation	2034	https://leetcode.com/problems/stock-price-fluctuation/	Stock Price Fluctuation
1158	leetcodeTitles	java	All Ancestors of a Node in a Directed Acyclic Graph	2192	https://leetcode.com/problems/all-ancestors-of-a-node-in-a-directed-acyclic-graph/	Ancestors Node Directed Acyclic Graph
1159	leetcodeTitles	java	Make Sum Divisible by P	1590	https://leetcode.com/problems/make-sum-divisible-by-p/	Make Sum Divisible P
1160	leetcodeTitles	java	Generate Random Point in a Circle	478	https://leetcode.com/problems/generate-random-point-in-a-circle/	Generate Random Point Circle
1161	leetcodeTitles	java	Adding Two Negabinary Numbers	1073	https://leetcode.com/problems/adding-two-negabinary-numbers/	Adding Negabinary Numbers
1162	leetcodeTitles	java	Linked List Components	817	https://leetcode.com/problems/linked-list-components/	Linked List Components
1163	leetcodeTitles	java	Display Table of Food Orders in a Restaurant	1418	https://leetcode.com/problems/display-table-of-food-orders-in-a-restaurant/	Display Table Food Orders Restaurant
1164	leetcodeTitles	java	Statistics from a Large Sample	1093	https://leetcode.com/problems/statistics-from-a-large-sample/	Statistics Large Sample
1165	leetcodeTitles	java	Keyboard Row	500	https://leetcode.com/problems/keyboard-row/	Keyboard Row
1166	leetcodeTitles	java	Construct the Lexicographically Largest Valid Sequence	1718	https://leetcode.com/problems/construct-the-lexicographically-largest-valid-sequence/	Construct Lexicographically Largest Valid Sequence
1167	leetcodeTitles	java	Plus One	66	https://leetcode.com/problems/plus-one/	
1168	leetcodeTitles	java	Coordinate With Maximum Network Quality	1620	https://leetcode.com/problems/coordinate-with-maximum-network-quality/	Coordinate Maximum Network Quality
1169	leetcodeTitles	java	Number of Good Ways to Split a String	1525	https://leetcode.com/problems/number-of-good-ways-to-split-a-string/	Number Good Ways Split String
1170	leetcodeTitles	java	Binary Search Tree Iterator	173	https://leetcode.com/problems/binary-search-tree-iterator/	Binary Search Tree Iterator
1171	leetcodeTitles	java	Minimum Operations to Make a Uni-Value Grid	2033	https://leetcode.com/problems/minimum-operations-to-make-a-uni-value-grid/	Minimum Operations Make Uni-Value Grid
1172	leetcodeTitles	java	Construct Binary Search Tree from Preorder Traversal	1008	https://leetcode.com/problems/construct-binary-search-tree-from-preorder-traversal/	Construct Binary Search Tree Preorder Traversal
1173	leetcodeTitles	java	Divisor Game	1025	https://leetcode.com/problems/divisor-game/	Divisor Game
1174	leetcodeTitles	java	Validate Stack Sequences	946	https://leetcode.com/problems/validate-stack-sequences/	Validate Stack Sequences
1175	leetcodeTitles	java	Find the Middle Index in Array	1991	https://leetcode.com/problems/find-the-middle-index-in-array/	Middle Index Array
1176	leetcodeTitles	java	Minimum Deletions to Make Array Beautiful	2216	https://leetcode.com/problems/minimum-deletions-to-make-array-beautiful/	Minimum Deletions Make Array Beautiful
1177	leetcodeTitles	java	Count Asterisks	2315	https://leetcode.com/problems/count-asterisks/	Count Asterisks
1178	leetcodeTitles	java	Check if a Parentheses String Can be Valid	2116	https://leetcode.com/problems/check-if-a-parentheses-string-can-be-valid/	Check Parentheses String be Valid
1179	leetcodeTitles	java	Partition Array Into Three Parts With Equal Sum	1013	https://leetcode.com/problems/partition-array-into-three-parts-with-equal-sum/	Partition Array Into Three Parts Equal Sum
1180	leetcodeTitles	java	H-Index II	275	https://leetcode.com/problems/h-index-ii/	H-Index II
1181	leetcodeTitles	java	Maximum Nesting Depth of Two Valid Parentheses Strings	1111	https://leetcode.com/problems/maximum-nesting-depth-of-two-valid-parentheses-strings/	Maximum Nesting Depth Valid Parentheses Strings
1182	leetcodeTitles	java	Eliminate Maximum Number of Monsters	1921	https://leetcode.com/problems/eliminate-maximum-number-of-monsters/	Eliminate Maximum Number Monsters
1183	leetcodeTitles	java	Minimum Path Cost in a Grid	2304	https://leetcode.com/problems/minimum-path-cost-in-a-grid/	Minimum Path Cost Grid
1184	leetcodeTitles	java	Shortest Path with Alternating Colors	1129	https://leetcode.com/problems/shortest-path-with-alternating-colors/	Shortest Path Alternating Colors
1185	leetcodeTitles	java	Maximum Number of Occurrences of a Substring	1297	https://leetcode.com/problems/maximum-number-of-occurrences-of-a-substring/	Maximum Number Occurrences Substring
1186	leetcodeTitles	java	Lowest Common Ancestor of a Binary Tree	236	https://leetcode.com/problems/lowest-common-ancestor-of-a-binary-tree/	Lowest Common Ancestor Binary Tree
1187	leetcodeTitles	java	Word Search	79	https://leetcode.com/problems/word-search/	Word Search
1188	leetcodeTitles	java	Minimum Deletions to Make String Balanced	1653	https://leetcode.com/problems/minimum-deletions-to-make-string-balanced/	Minimum Deletions Make String Balanced
1189	leetcodeTitles	java	Number of Steps to Reduce a Number in Binary Representation to One	1404	https://leetcode.com/problems/number-of-steps-to-reduce-a-number-in-binary-representation-to-one/	Number Steps Reduce Number Binary Representation
1190	leetcodeTitles	java	Maximum Area of a Piece of Cake After Horizontal and Vertical Cuts	1465	https://leetcode.com/problems/maximum-area-of-a-piece-of-cake-after-horizontal-and-vertical-cuts/	Maximum Area Piece Cake Horizontal Vertical Cuts
1191	leetcodeTitles	java	Reverse Nodes in Even Length Groups	2074	https://leetcode.com/problems/reverse-nodes-in-even-length-groups/	Reverse Nodes Even Length Groups
1192	leetcodeTitles	java	Merge in Between Linked Lists	1669	https://leetcode.com/problems/merge-in-between-linked-lists/	Merge Between Linked Lists
1193	leetcodeTitles	java	Path with Maximum Probability	1514	https://leetcode.com/problems/path-with-maximum-probability/	Path Maximum Probability
1194	leetcodeTitles	java	Remove Linked List Elements	203	https://leetcode.com/problems/remove-linked-list-elements/	Remove Linked List Elements
1195	leetcodeTitles	java	Find the Highest Altitude	1732	https://leetcode.com/problems/find-the-highest-altitude//	Highest Altitude
1196	leetcodeTitles	java	Ugly Number III	1201	https://leetcode.com/problems/ugly-number-iii/	Number III
1197	leetcodeTitles	java	Increasing Order Search Tree	897	https://leetcode.com/problems/increasing-order-search-tree/	Increasing Order Search Tree
1198	leetcodeTitles	java	Maximum Population Year	1854	https://leetcode.com/problems/maximum-population-year/	Maximum Population Year
1199	leetcodeTitles	java	Minimum Lines to Represent a Line Chart	2280	https://leetcode.com/problems/minimum-lines-to-represent-a-line-chart/	Minimum Lines Represent Line Chart
1200	leetcodeTitles	java	Generate a String With Characters That Have Odd Counts	1374	https://leetcode.com/problems/generate-a-string-with-characters-that-have-odd-counts/	Generate String Characters Have Odd Counts
1201	leetcodeTitles	java	All Possible Full Binary Trees	894	https://leetcode.com/problems/all-possible-full-binary-trees/	Possible Full Binary Trees
1202	leetcodeTitles	java	Find All Lonely Number in the Array	2150	https://leetcode.com/problems/find-all-lonely-numbers-in-the-array/	All Lonely Number Array
1203	leetcodeTitles	java	Bitwise ORs of Subarrays	898	https://leetcode.com/problems/bitwise-ors-of-subarrays/	Bitwise ORs Subarrays
1204	leetcodeTitles	java	Basic Calculator II	227	https://leetcode.com/problems/basic-calculator-ii/	Basic Calculator II
1205	leetcodeTitles	java	Minimum Sum of Four Digit Number After Splitting Digits	2160	https://leetcode.com/problems/minimum-sum-of-four-digit-number-after-splitting-digits/	Minimum Sum Four Digit Number Splitting Digits
1206	leetcodeTitles	java	Deepest Leaves Sum	1302	https://leetcode.com/problems/deepest-leaves-sum/	Deepest Leaves Sum
1207	leetcodeTitles	java	Minimum Operations to Make Array Equal	1551	https://leetcode.com/problems/minimum-operations-to-make-array-equal/	Minimum Operations Make Array Equal
1208	leetcodeTitles	java	Mini Parser	385	https://leetcode.com/problems/mini-parser/	Mini Parser
1209	leetcodeTitles	java	Maximum Number of Balloons	1189	https://leetcode.com/problems/maximum-number-of-balloons/	Maximum Number Balloons
1210	leetcodeTitles	java	Coin Change 2	518	https://leetcode.com/problems/coin-change-2/	Coin Change
1211	leetcodeTitles	java	Beautiful Arrangement II	667	https://leetcode.com/problems/beautiful-arrangement-ii/	Beautiful Arrangement II
1212	leetcodeTitles	java	Rectangle Area	223	https://leetcode.com/problems/rectangle-area/	Rectangle Area
1213	leetcodeTitles	java	Find Missing Observations	2028	https://leetcode.com/problems/find-missing-observations/	Missing Observations
1214	leetcodeTitles	java	Number of Substrings With Only 1s	1513	https://leetcode.com/problems/number-of-substrings-with-only-1s/	Number Substrings
1215	leetcodeTitles	java	Number of Ways to Split a String	1573	https://leetcode.com/problems/number-of-ways-to-split-a-string/	Number Ways Split String
1216	leetcodeTitles	java	Container With Most Water	11	https://leetcode.com/problems/container-with-most-water/	Container Most Water
1217	leetcodeTitles	java	Guess Number Higher or Lower	374	https://leetcode.com/problems/guess-number-higher-or-lower/	Guess Number Higher Lower
1218	leetcodeTitles	java	Reverse Vowels of a String	345	https://leetcode.com/problems/reverse-vowels-of-a-string/	Reverse Vowels String
1219	leetcodeTitles	java	Minimum Swaps to Arrange a Binary Grid	1536	https://leetcode.com/problems/minimum-swaps-to-arrange-a-binary-grid/	Minimum Swaps Arrange Binary Grid
1220	leetcodeTitles	java	Detonate the Maximum Bombs	2101	https://leetcode.com/problems/detonate-the-maximum-bombs/	Detonate Maximum Bombs
1221	leetcodeTitles	java	Convert Binary Number in a Linked List to Integer	1290	https://leetcode.com/problems/convert-binary-number-in-a-linked-list-to-integer/	Convert Binary Number Linked List Integer
1222	leetcodeTitles	java	Monotonic Array	896	https://leetcode.com/problems/monotonic-array/	Monotonic Array
1223	leetcodeTitles	java	Find Center of Star Graph	1791	https://leetcode.com/problems/find-center-of-star-graph/	Find Center Star Graph
1224	leetcodeTitles	java	Unique Email Addresses	929	https://leetcode.com/problems/unique-email-addresses/	Unique Email Addresses
1225	leetcodeTitles	java	The Number of the Smallest Unoccupied Chair	1942	https://leetcode.com/problems/the-number-of-the-smallest-unoccupied-chair/	Number Smallest Unoccupied Chair
1226	leetcodeTitles	java	Where Will the Ball Fall	1706	https://leetcode.com/problems/where-will-the-ball-fall/	Ball Fall
1227	leetcodeTitles	java	Wiggle Sort II	324	https://leetcode.com/problems/wiggle-sort-ii/	Wiggle Sort II
1228	leetcodeTitles	java	Maximum Difference Between Increasing Elements	2016	https://leetcode.com/problems/maximum-difference-between-increasing-elements/	Maximum Difference Between Increasing Elements
1229	leetcodeTitles	java	Convert Integer to the Sum of Two No-Zero Integers	1317	https://leetcode.com/problems/convert-integer-to-the-sum-of-two-no-zero-integers/	Convert Integer Sum No-Zero Integers
1230	leetcodeTitles	java	Special Positions in a Binary Matrix	1582	https://leetcode.com/problems/special-positions-in-a-binary-matrix/	Special Positions Binary Matrix
1231	leetcodeTitles	java	Sort Even and Odd Indices Independently	2164	https://leetcode.com/problems/sort-even-and-odd-indices-independently/	Sort Even Odd Indices Independently
1232	leetcodeTitles	java	Minimum Number of Operations to Convert Time	2224	https://leetcode.com/problems/minimum-number-of-operations-to-convert-time/	Minimum Number Operations Convert Time
1233	leetcodeTitles	java	New 21 Game	837	https://leetcode.com/problems/new-21-game/	New Game
1234	leetcodeTitles	java	Simplified Fractions	1447	https://leetcode.com/problems/simplified-fractions/	Simplified Fractions
1235	leetcodeTitles	java	Relative Sort Array	1122	https://leetcode.com/problems/relative-sort-array/	Relative Sort Array
1236	leetcodeTitles	java	N-ary Tree Level Order Traversal	429	https://leetcode.com/problems/n-ary-tree-level-order-traversal/	N-ary Tree Level Order Traversal
1237	leetcodeTitles	java	Magical String	481	https://leetcode.com/problems/magical-string/	Magical String
1238	leetcodeTitles	java	Repeated String Match	686	https://leetcode.com/problems/repeated-string-match/	Repeated String Match
1239	leetcodeTitles	java	Three Consecutive Odds	1550	https://leetcode.com/problems/three-consecutive-odds/	Consecutive Odds
1240	leetcodeTitles	java	3Sum With Multiplicity	923	https://leetcode.com/problems/3sum-with-multiplicity/	Multiplicity
1241	leetcodeTitles	java	Defuse the Bomb	1652	https://leetcode.com/problems/defuse-the-bomb/	Bomb
1242	leetcodeTitles	java	Maximum Repeating Substring	1668	https://leetcode.com/problems/maximum-repeating-substring/	Maximum Repeating Substring
1243	leetcodeTitles	java	Search in Rotated Sorted Array	33	https://leetcode.com/problems/search-in-rotated-sorted-array/	Search Rotated Sorted Array
1244	leetcodeTitles	java	Find And Replace in String	833	https://leetcode.com/problems/find-and-replace-in-string/	Find Replace String
1245	leetcodeTitles	java	Maximum Width Ramp	962	https://leetcode.com/problems/maximum-width-ramp/	Maximum Width Ramp
1246	leetcodeTitles	java	Calculate Digit Sum of a String	2243	https://leetcode.com/problems/calculate-digit-sum-of-a-string/	Calculate Digit Sum String
1247	leetcodeTitles	java	Circle and Rectangle Overlapping	1401	https://leetcode.com/problems/circle-and-rectangle-overlapping/	Circle Rectangle Overlapping
1248	leetcodeTitles	java	Check Wheter Two Strings are Almost Equivalent	2068	https://leetcode.com/problems/check-whether-two-strings-are-almost-equivalent/	Check Wheter Strings are Almost Equivalent
1249	leetcodeTitles	java	Add Digits	258	https://leetcode.com/problems/add-digits/	Add Digits
1250	leetcodeTitles	java	Sum of Subarray Ranges	2104	https://leetcode.com/problems/sum-of-subarray-ranges/	Sum Subarray Ranges
1251	leetcodeTitles	java	Greatest Common Divisor of Strings	1071	https://leetcode.com/problems/greatest-common-divisor-of-strings/	Greatest Common Divisor Strings
1252	leetcodeTitles	java	Single Number	136	https://leetcode.com/problems/single-number/	Single Number
1253	leetcodeTitles	java	Count Items Matching a Rule	1773	https://leetcode.com/problems/count-items-matching-a-rule/	Count Items Matching Rule
1254	leetcodeTitles	java	K-diff Pairs in an Array	532	https://leetcode.com/problems/k-diff-pairs-in-an-array/	K-diff Pairs Array
1255	leetcodeTitles	java	Domino and Tromino Tiling	790	https://leetcode.com/problems/domino-and-tromino-tiling/	Domino Tromino Tiling
1256	leetcodeTitles	java	Maximum Average Pass Ratio	1792	https://leetcode.com/problems/maximum-average-pass-ratio/	Maximum Average Pass Ratio
1257	leetcodeTitles	java	Remove One Element to Make the Array Strictly Increasing	1909	https://leetcode.com/problems/remove-one-element-to-make-the-array-strictly-increasing/	Remove Element Make Array Strictly Increasing
1258	leetcodeTitles	java	Task Scheduler	621	https://leetcode.com/problems/task-scheduler/	Task Scheduler
1259	leetcodeTitles	java	Consecutive Characters	1446	https://leetcode.com/problems/consecutive-characters/	Consecutive Characters
1260	leetcodeTitles	java	Count Servers that Communicate	1267	https://leetcode.com/problems/count-servers-that-communicate/	Count Servers Communicate
1261	leetcodeTitles	java	Minimum Time to Make Rope Colorful	1578	https://leetcode.com/problems/minimum-time-to-make-rope-colorful/	Minimum Time Make Rope Colorful
1262	leetcodeTitles	java	UTF-8 Validation	393	https://leetcode.com/problems/utf-8-validation/	UTF-8 Validation
1263	leetcodeTitles	java	Check If Two String Arrays are Equivalent	1662	https://leetcode.com/problems/check-if-two-string-arrays-are-equivalent/	Check String Arrays are Equivalent
1264	leetcodeTitles	java	Find Unique Binary String	1980	https://leetcode.com/problems/find-unique-binary-string/	Find Unique Binary String
1265	leetcodeTitles	java	Guess Number Higher or Lower II	375	https://leetcode.com/problems/guess-number-higher-or-lower-ii/	Guess Number Higher Lower II
1266	leetcodeTitles	java	Binary Tree Level Order Traversal	102	https://leetcode.com/problems/binary-tree-level-order-traversal/	Binary Tree Level Order Traversal
1267	leetcodeTitles	java	Jump Game II	227	https://leetcode.com/problems/jump-game-ii/	Jump Game II
1268	leetcodeTitles	java	Convert 1D Array Into 2D Array	2022	https://leetcode.com/problems/convert-1d-array-into-2d-array/	Convert Array Into Array
1269	leetcodeTitles	java	Surface Area of 3D Shapes	892	https://leetcode.com/problems/surface-area-of-3d-shapes/	Surface Area Shapes
1270	leetcodeTitles	java	Maximum Difference Between Node and Ancestor	1026	https://leetcode.com/problems/maximum-difference-between-node-and-ancestor/	Maximum Difference Between Node Ancestor
1271	leetcodeTitles	java	X of a Kind in a Deck of Cards	914	https://leetcode.com/problems/x-of-a-kind-in-a-deck-of-cards/	X Kind Deck Cards
1272	leetcodeTitles	java	Count of Matches in Tournament	1688	https://leetcode.com/problems/count-of-matches-in-tournament/	Count Matches Tournament
1273	leetcodeTitles	java	Largest Substring Between Two Equal Characteres	1624	https://leetcode.com/problems/largest-substring-between-two-equal-characters/	Largest Substring Between Equal Characteres
1274	leetcodeTitles	java	Remove K Digits	402	https://leetcode.com/problems/remove-k-digits/	Remove K Digits
1275	leetcodeTitles	java	Minimum Score Triangulation of Polygon	1039	https://leetcode.com/problems/minimum-score-triangulation-of-polygon/	Minimum Score Triangulation Polygon
1276	leetcodeTitles	java	Number of Closed Islands	1254	https://leetcode.com/problems/number-of-closed-islands/	Number Closed Islands
1277	leetcodeTitles	java	Maximum Number of Non-Overlapping Subarrays With Sum Equals Target	1546	https://leetcode.com/problems/maximum-number-of-non-overlapping-subarrays-with-sum-equals-target/	Maximum Number Non-Overlapping Subarrays Sum Equals Target
1278	leetcodeTitles	java	Insufficient Nodes in Root to Leaf Paths	1080	https://leetcode.com/problems/insufficient-nodes-in-root-to-leaf-paths/	Insufficient Nodes Root Leaf Paths
1279	leetcodeTitles	java	Convert to Base -2	1017	https://leetcode.com/problems/convert-to-base-2/	Convert Base -2
1280	leetcodeTitles	java	Count Elements With Strictly Smaller and Greater Elements	2148	https://leetcode.com/problems/count-elements-with-strictly-smaller-and-greater-elements/	Count Elements Strictly Smaller Greater Elements
1281	leetcodeTitles	java	Partition Array for Maximum Sum	1043	https://docs.google.com/spreadsheets/d/1MUtHfwbkWO4W69NaNiwv_hgABNfXZu2M69PNgL8PBXs/edit#gid=0	Partition Array Maximum Sum
1282	leetcodeTitles	java	Sum of Numbers With Units Digit K	2310	https://leetcode.com/problems/sum-of-numbers-with-units-digit-k/	Sum Numbers Units Digit K
1283	leetcodeTitles	java	Contains Duplicate	217	https://leetcode.com/problems/contains-duplicate/	Contains Duplicate
1284	leetcodeTitles	java	Minimum Number of Days to Make m Bouquets	1482	https://leetcode.com/problems/minimum-number-of-days-to-make-m-bouquets/	Minimum Number Days Make m Bouquets
1285	leetcodeTitles	java	Number of Lines To Write String	806	https://leetcode.com/problems/number-of-lines-to-write-string/	Number Lines Write String
1286	leetcodeTitles	java	Set Mismatch	645	https://leetcode.com/problems/set-mismatch/	Set Mismatch
1287	leetcodeTitles	java	Construct the Rectangle	492	https://leetcode.com/problems/construct-the-rectangle/	Construct Rectangle
1288	leetcodeTitles	java	Group Anagrams	49	https://leetcode.com/problems/group-anagrams/	Group Anagrams
1289	leetcodeTitles	java	Single Element in a Sorted Array	540	https://leetcode.com/problems/single-element-in-a-sorted-array/	Single Element Sorted Array
1290	leetcodeTitles	java	Most Visited Sector in a Circular Track	1560	https://leetcode.com/problems/most-visited-sector-in-a-circular-track/	Most Visited Sector Circular Track
1291	leetcodeTitles	java	Add Strings	415	https://leetcode.com/problems/add-strings/	Add Strings
1292	leetcodeTitles	java	Design Bitset	2166	https://leetcode.com/problems/design-bitset/	Design Bitset
1293	leetcodeTitles	java	Out of Boundary Paths	576	https://leetcode.com/problems/out-of-boundary-paths/	Boundary Paths
1294	leetcodeTitles	java	Check if N and Its Double Exist	1346	https://leetcode.com/problems/check-if-n-and-its-double-exist/	Check N Double Exist
1295	leetcodeTitles	java	Get Equal Substrings Within Budget	1208	https://leetcode.com/problems/get-equal-substrings-within-budget/	Get Equal Substrings Within Budget
1296	leetcodeTitles	java	Number of Restricted Paths From First to Last Node	1786	https://leetcode.com/problems/number-of-restricted-paths-from-first-to-last-node/	Number Restricted Paths From First Last Node
1297	leetcodeTitles	java	Unique Paths	62	https://leetcode.com/problems/unique-paths/	Unique Paths
1298	leetcodeTitles	java	Combination Sum II	40	https://leetcode.com/problems/combination-sum-ii/	Combination Sum II
1299	leetcodeTitles	java	Find Target Indices After Sorting Array	2089	https://leetcode.com/problems/find-target-indices-after-sorting-array/	Find Target Indices Sorting Array
1300	leetcodeTitles	java	Add Binary	67	https://leetcode.com/problems/add-binary/	Add Binary
1301	leetcodeTitles	java	Permutations	46	https://leetcode.com/problems/permutations/	Permutations
1302	leetcodeTitles	java	Even Odd Tree	1609	https://leetcode.com/problems/even-odd-tree/	Odd Tree
1303	leetcodeTitles	java	Broken Calculator	991	https://leetcode.com/problems/broken-calculator/	Broken Calculator
1304	leetcodeTitles	java	Kth Distinct String in an Array	2053	https://leetcode.com/problems/kth-distinct-string-in-an-array/	Kth Distinct String Array
1305	leetcodeTitles	java	Find if Path Exists in Graph	1971	https://leetcode.com/problems/find-if-path-exists-in-graph/	Path Exists Graph
1306	leetcodeTitles	java	Excel Sheet Column Number	171	https://leetcode.com/problems/excel-sheet-column-number/	Excel Sheet Column Number
1307	leetcodeTitles	java	Two Sum IV - Input a BST	653	https://leetcode.com/problems/two-sum-iv-input-is-a-bst/	Sum IV Input BST
1308	leetcodeTitles	java	Matrix Cells in Distance Order	1030	https://leetcode.com/problems/matrix-cells-in-distance-order/	Matrix Cells Distance Order
1309	leetcodeTitles	java	Plates Between Candles	2055	https://leetcode.com/problems/plates-between-candles/	Plates Between Candles
1310	leetcodeTitles	java	Reorder List	143	https://leetcode.com/problems/reorder-list/	Reorder List
1311	leetcodeTitles	java	Restore IP Addresses	93	https://leetcode.com/problems/restore-ip-addresses/	IP Addresses
1312	leetcodeTitles	java	Count Primes	204	https://leetcode.com/problems/count-primes/	Count Primes
1313	leetcodeTitles	java	Number of Nodes in the Sub-Tree With the Same Label	1519	https://leetcode.com/problems/number-of-nodes-in-the-sub-tree-with-the-same-label/	Number Nodes Sub-Tree Same Label
1314	leetcodeTitles	java	Maximum Product of Two Elements in an Array	1464	https://leetcode.com/problems/maximum-product-of-two-elements-in-an-array/	Maximum Product Elements Array
1315	leetcodeTitles	java	Most Frequent Subtree Sum	508	https://leetcode.com/problems/most-frequent-subtree-sum/	Most Frequent Subtree Sum
1316	leetcodeTitles	java	Best Time to Buy and Sell Stock	121	https://leetcode.com/problems/best-time-to-buy-and-sell-stock/	Time Buy Sell Stock
1317	leetcodeTitles	java	Nim Game	292	https://leetcode.com/problems/nim-game/	Nim Game
1318	leetcodeTitles	java	Number of People Aware of a Secret	2327	https://leetcode.com/problems/number-of-people-aware-of-a-secret/	Number People Aware Secret
1319	leetcodeTitles	java	Champagne Tower	799	https://leetcode.com/problems/champagne-tower/	Champagne Tower
1320	leetcodeTitles	java	Remove Palindromic Subsequences	1332	https://leetcode.com/problems/remove-palindromic-subsequences/	Remove Palindromic Subsequences
1321	leetcodeTitles	java	Delete Columns to Make Sorted II	955	https://leetcode.com/problems/delete-columns-to-make-sorted-ii/	Delete Columns Make Sorted II
1322	leetcodeTitles	java	Integer Replacement	397	https://leetcode.com/problems/integer-replacement/	Integer Replacement
1323	leetcodeTitles	java	Longest Continuous Subarray With Absolute Diff Less Than or Equal to Limit	1438	https://leetcode.com/problems/longest-continuous-subarray-with-absolute-diff-less-than-or-equal-to-limit/	Longest Continuous Subarray Absolute Diff Less Than Equal Limit
1324	leetcodeTitles	java	Sort Array By Parity II	922	https://leetcode.com/problems/sort-array-by-parity-ii/	Sort Array Parity II
1325	leetcodeTitles	java	Maximum Product Subarray	152	https://leetcode.com/problems/maximum-product-subarray/	Maximum Product Subarray
1326	leetcodeTitles	java	Beautiful Array	932	https://leetcode.com/problems/beautiful-array/	Beautiful Array
1327	leetcodeTitles	java	Widest Vertical Area Between Two Points Containing No Points	1637	https://leetcode.com/problems/widest-vertical-area-between-two-points-containing-no-points/	Widest Vertical Area Between Points Containing Points
1328	leetcodeTitles	java	Final Value of Variable After Performing Operations	2011	https://leetcode.com/problems/final-value-of-variable-after-performing-operations/	Final Value Variable Performing Operations
